{
  "authority": "coordination",
  "budget": {"max_parallel": 2, "max_tasks": 3, "max_total_attempts": 6, "used_attempts": 6, "used_tasks": 3},
  "conflicts": [],
  "contract": "multi-world-orchestration-receipt.v0.1",
  "evidence_hash": "de736108a0205056c2d3c6d4b58c419d976620a6b9867bf0e3ef081e903b28e7",
  "execution_batches": [["alien-audio", "relay-activation-recipe"], ["alien-mutation-recipe"]],
  "orchestration_id": "orchestration-run:167b51dd685be3b3",
  "plan_id": "orchestration:phase12.multi-world:v0.1",
  "promotion": {"canonical_write": false, "reason": "all scheduled child tasks produced independently validated candidates; orchestration grants no canonical write authority", "status": "coordination_complete"},
  "source_hashes": {"plan": "a6d99eb50f58353a07f154dfe087317bbe2aec418aa70eb3e55c8447efd1200d", "project_state": "47f0ddee8fe0cf961ff8a3b1a5d3ab83ea00a8d5d9de6e34779240f65fb30394"},
  "status": "completed",
  "task_results": [
    {"attempts": 2, "canonical_write": false, "evidence_hash": "958125f9aab8833d2a03c964bc22b33fc9624774f5edaa758f2293f56a391042", "graph_snapshot_id": "graph:7b410aa3cc2a3551", "orchestration_task_id": "alien-audio", "run_id": "assembler-run:bdd8cc22420b1848", "selected_candidate_sha256": "28f03358e57423849a0a88e87221412ad7421c5c1defea70662f8e23191baabf", "status": "validated_candidate", "target_node_id": "artifact.audio.crystal_filterer.attack", "task_id": "assembler:alien-lineage.attack-audio:v0.1", "world_scope": "game.alien_lineage"},
    {"attempts": 2, "canonical_write": false, "evidence_hash": "95efc708f65f685c33647aa9f0dfdfb74513087732a85e95698a44e90cbdbd18", "graph_snapshot_id": "graph:1dc2d56086e476f4", "orchestration_task_id": "relay-activation-recipe", "run_id": "assembler-run:5d782e7fa5974312", "selected_candidate_sha256": "ea8e25f916df287242fa2096933f7576c3f8efa560245d05e067dbb6f9f11817", "status": "validated_candidate", "target_node_id": "artifact.presentation.threejs.relay_activation_recipe", "task_id": "assembler:relay-station.activation-effect-recipe:v0.1", "world_scope": "game.relay_station"},
    {"attempts": 2, "canonical_write": false, "evidence_hash": "098f541b1ae6346fb0839a2a62f19cc4b7846ca5a39ddd241d1828be107871f9", "graph_snapshot_id": "graph:f5b7af776a90a295", "orchestration_task_id": "alien-mutation-recipe", "run_id": "assembler-run:31122b2788f25e30", "selected_candidate_sha256": "c26cd3b1af92ca515ca81680f2982bb296237ff38f4fe95ca930f2eb83bcaeb5", "status": "validated_candidate", "target_node_id": "artifact.presentation.threejs.mutation_effect_recipe", "task_id": "assembler:alien-lineage.mutation-effect-recipe:v0.1", "world_scope": "game.alien_lineage"}
  ],
  "world_evidence": [
    {"child_evidence_hashes": ["958125f9aab8833d2a03c964bc22b33fc9624774f5edaa758f2293f56a391042", "098f541b1ae6346fb0839a2a62f19cc4b7846ca5a39ddd241d1828be107871f9"], "evidence_hash": "fbc28d98bdd88cd22e0a7eb8e54e89c7be8859ee71b2878b4ef8b7a3c2033b9a", "orchestration_task_ids": ["alien-audio", "alien-mutation-recipe"], "world_scope": "game.alien_lineage"},
    {"child_evidence_hashes": ["95efc708f65f685c33647aa9f0dfdfb74513087732a85e95698a44e90cbdbd18"], "evidence_hash": "1c2ce01ad5fab2da292e418252b1bfb8dd235f2d3f21ecb2e982560afb3ac836", "orchestration_task_ids": ["relay-activation-recipe"], "world_scope": "game.relay_station"}
  ]
}
